<?xml version="1.0" encoding="UTF-8"?>
<playlist autor="John Doe" users_voted="0" xmlns:xsi="http://www.w3.org/2001/XMLSchema-instance" xsi:noNamespaceSchemaLocation="playlist.xsd">
    <name>My Playlist</name>
    <totallength unit="min">120</totallength>
    <genre type="rock">Rock</genre>
    <album name="Greatest Hits">
        <song>Hit Song 1</song>
        <song>Hit Song 2</song>
    </album>
    <song>Single Song 1</song>
    <song>Single Song 2</song>
</playlist>